Item,Price
"Tidy Cats Clumping Multi Cat Litter, Glade Clear Springs - 38 lb. Box",26
COMFORT ZONE 6 Pack MultiCat Diffuser Refills,45
COMFORT ZONE Value Kit; 3 Multicat Diffusers & 6 Refills,53
Fancy Feast Gravy Lovers Poultry and Beef Grilled Gourmet Wet Cat Food Variety Pack - (Pack of 30) 3 oz. Cans,26
Fancy Feast Gravy Lovers Poultry and Beef Grilled Gourmet Wet Cat Food Variety Pack - (Pack of 24) 3 oz. Cans,21
"HOOBRO Wooden Cat Tree, Versatile Cat Tower with Scratching Post, Cat Hammock and Food Bowls, 4-Tier Pet House for Indoor Cats, Multi-Cat Families, Greige BG34MZ03",68
"Boscute Charcoal Super Absorbency Puppy Pads, Activated Carbon Odor-Control XXXL 36""x36"" ",37
"Boscute Odor-Control Super Absorbency Charcoal Puppy Pads, XXL 30""x36""",40
"Boscute Charcoal Super Absorbency Puppy Pads, Activated Carbon Odor-Control XL 28""x34"" ",28
"Vetoquinol Pro-Pectalin Oral Paste for Dogs & Cats, Chicken, 15cc",18
FELIWAY® Optimum 30 Day Cat Calming Plug In Pheromone Diffuser Starter Kit,30
FELIWAY MultiCat 30 Day Cat Calming Plug In Pheromone Diffuser Starter Kit,25
"Purina Fancy Feast Delights with Cheddar Grilled Chicken, Turkey or Whitefish and Cheddar Cheese Feast in Gravy Wet Cat Food Variety Pack - (Pack of 24) 3 oz. Cans",21
Purina Fancy Feast Grilled Wet Cat Food Seafood Collection in Wet Cat Food Variety Pack - (Pack of 24) 3 oz. Cans,21
"Sheba Perfect Portions Grain-Free Gourmet Cuts in Gravy Variety Pack Adult Wet Cat Food Trays, 2.6-oz, case of 24",24
"Sheba Perfect Portions Grain-Free Gourmet Pate Variety Pack Adult Wet Cat Food Trays, 2.6-oz, case of 24",24
"Temptations Cat Treats, any variety, 16-oz tub",9
"Tidy Cats Glade Clear Springs Scented Clumping Cat Litter, 14-lb jug",10
"Tidy Cats Instant Action Scented Clumping Cat Litter, 35-lb pail",19
"Yaheetech Multi-Level 63-in Plush Cat Tree, Dark Gray",51
"Frisco Sherpa Reversible Cat Mat, Calico Cat",8
Best Friends by Sheri Throw Calming Shag Ultra Soft Faux Fur Cat & Dog Blanket,14
"Frisco Adjustable Bolster Cat Bed, Calico Cat",16
"Allisandro Quilted Self Warming Cat & Dog Bed, Grey, any size",25-40
"Frisco Quilted Orthopedic Pillow Lounger Cat & Dog Bed with Removable Cover, Gray, Large",30
Fancy Feast Kitten Classic Pate Variety Pack Canned Wet Cat Food 3-oz cans,21
Frisco Cushioned Wall Mounted Cat Wall Shelf,25
"Frisco Wall Mounted Cat Steps, 4 pack",30
"PETOMG Wall Mounted House Cat Wall Shelf, Wood Color, Medium",65
EYS Narwhal Unicorn Whale Flop & Jump Interactive Plush Cat Toy with Catnip,17
"PawsPik Suction Cup Cat Laser Toy, White",23
SmartyKat Instincts Soarin' Squirrel,6
The Ripple Rug,47
REScue One-Step Disinfectant Cleaner & Deodorizer 1gal,58
"REScue One-Step Ready-to-Use Disinfectant Cleaner & Deodorizer, 32oz",16
"OdoBan Disinfectant Concentrate, Eucalyptus Scent, 1 Gallon",13
"OdoBan Ready-to-Use Disinfectant, 32 Oz, Eucalyptus Scent",4
"Amazon Basic Care - Aloe Vera Hand Sanitizer, 34 fl oz (Pack of 4)",27
"Medical Soft Max Nitrile Exam Gloves, 100 Count Latex-Free, Blue, Medium",8
PawsPik Interactive Fast Rolling Play Mat Ball Cat Toy,30
"WePet Cat Litter Scoop, Aluminum Alloy Sifter",9
"Clorox Disinfecting Bleach, 81 Fluid Ounces",7
"KONG Play Spaces Rave Cave Cat Tunnels with Catnip Toy, Multicolor",21